390,NA,avila,interview,4/24/23 16:11,2,1,2,2,2,2,1,1,2,1,2,2,2,2,1,1,2,2,2,2,2,1,1,2,2,2,1,1,2,2,1,1,2,1,2,2,2,2,2,1,,The child appears to be a 5 year old male. ,,,,,The child appears to be male approximately 7 years of age. ,The child appears to be female and 4 years old.,,The child appears to be female approximately 5 years of age. ,,,,,Male 10 years old looks like he is scared. ,The child appears to be a mole of approximatly 1 year of age. ,,,,,,The child appears to be female approximately 7 years of age. ,The child appears to be a male approximately 7 years old. ,,,,The child appears to be male and approximately 4 years of age. ,The child appears to be female approximately 5 years of age.,,,The child appears to be a female of 6 years of age. ,Male 5 years old approximately. Looks like he is getting medical care. ,,The child appears to be a 3 year old female. ,,,,,,The young child appears to be female approximately 3 years of age. ,6,6,5,4,2,4,1,3,6,4,2,6,6,6,3,6,6,6,4,4,"The child appears to have feelings of lonliness, like he is missing someone. ",,The child looks like he is scared and hungry ,"The child appears to be having the experience of change of environment around them, and is feeling unsure of what is going on around them. ",The child appears to be experiencing feelings of being unsure and about new surroundings and being scared of the change that is going on in their lives. ,The child appears to be experienceing a change in environment and feeling scared and lost. ,,,The child appears to be experiencing a loss and is feeling sad.,,The child appears to be having the experience of haveing a change in their environment around them but is happy but unsure of where they are at. ,The child appears to have feelings of being scared and unsure of what is going to happen next. ,The child seems to be experiencing a loss and is feeling sad. ,The child appears to be scared. ,,,The child appears to be feeling sad like they have just experienced a loss or a change in environment. ,The child appears to be experiencing a loss and is feeling scared. ,The child appears to be having the feelings of hunger and being scared due to what is going on around him. ,The child appears to be experiencing a same day over again and is looking at the camera like they are bored. ,The child seems to be showing feelings of being unsure about what is going on around him. ,,,The child appears to be experiencing  a new environment and is feeling unsure but confident in their new environment. ,The young child appears to be scared and missing people as evident by the tears and the way she is looking at the camera as if she is looking for someone. ,The child appears to be experiencing a change of environment and is feeling bored and unsure of what is going on. ,,,"The child appears to be tired, like the child just wants to go home and be with family and not in a group of people. ",The child appears to experiencing a new environment and is unsure of the place that they are currently in. ,,,The child appears to have feelings of being scared of her environment around her. ,,The child appears to be experiencing a new invironment and appears to be feeling sad and unsure of what is going on. ,The child appears to be experiencing being in a new environment and is having feeling of being unsure and angry at their current situation. ,The child appears to be experiencing a chang in living situations and is scared. ,The child appears to have feelings of loneliness. ,The child appears to be experiencing a seperation from family and is feeling sad but content with the environment that they are in. ,,Repetative ,If i got tired of thinking about what they were feeling i chose describe.,no,no,3,2,3,3,4,3,1,4,male,white,34,6,1,4,129,3,15,32,1,19,40,25,12,2,38,33,23,21,14,5,13,29,39,36,17,11,4,34,8,30,35,9,18,31,27,10,6,26,37,24,20,16,7,22,28,4,5,4,157,5,24,37,71,7,64,3,78,11,92,4,21,3,37,9,62,4,19,3,51,8,94,6,32,4,76,12,67,3,33,4,50,7,104,4,96,2,77,3,57,4,26,5,41,2,46,7,69,3,82,4,21,4,19,3,63,3,55,6,19,3,41,5,71,5,23,3,67,3,57,4,46,3,100,3,59,4,48,328,61,40,168,2,NA,2609,NA,4/24/23 17:03,1,0,87,87,0,0,0.77,9,,,,,,,,,,,,,,,,,,,,,,,,,,,,,,,,,,,,,,,,
394,NA,SONA,interview,4/24/23 17:48,2,2,1,2,2,2,2,1,2,2,1,2,2,2,2,2,1,2,2,2,2,1,2,1,2,2,1,1,2,2,2,2,2,2,1,2,1,2,2,2,,,This is a boy and he is around 4,,,,,This is a girl and she is around 7,,,This is a girl and she is around 5. ,,,,,,I am not sure of the gender of this person because I can not recognize masculine or feminine facial features because the kid is around maybe 4-6 years old.,,,,,This is a boy around 6,,The little boy is around 5 years old and the little boy has short hair and big brown eyes. ,,,This is a boy and he is 7,This person is a boy around 8,,,,,,,This is a boy around 3,,This is a boy around 7,,,,3,7,4,3,1,1,1,1,6,7,3,3,6,7,2,3,7,7,2,2,This person looks very mad,This person is feeling annoyed,,This person is feeling confused or annoyed,This person is feeling upset,This little girl is feeling tired,This person is feeling comfortable or relaxed,,This boy looks bored or annoyed the camera man is takiing pics of him,This boy is feeling frusterated,,This person is feeling sad ,This person is feeling sad or frusterated,This boy is feeling upset,This person is feeling sad,This person is feling upset,,This person is feeling bored and has probably experienced living in a village,"The feelings of this person are anxiety, hunger, or being uncomfortable. ",This boy is feeling annoyed,This person is feeling uncomfortable,,This boy is hungry and probably annoyed someone is taking a picture of him,,This girl is feeling tired,This boy looks bored,,,This person is feeling tired or bored,This person is feeling bored ,This person is feeling tired or relaxed,This person is feeling uncomfortable or confused,This person could be feeling sad or needing affection,This person is feeling sad,,This boy is feeling annoyed,,This person is feeling sad or tired,This person is feeling tired,This person is feeling tired,repetitive,i just randomly selected,i liked the describe,"yes, one of the decks asked to imagine their experiences and how they feel and the other one wanted me to guess their age and gener",2,3,3,4,3,3,4,3,Female,White,18,4,3,4,130,24,19,17,11,27,32,12,33,4,31,13,7,38,16,29,10,25,30,6,3,8,5,21,2,14,34,39,40,1,26,20,36,9,15,23,18,22,28,37,35,3,2,2,12,2,11,5,13,3,12,2,11,1,13,1,19,3,13,3,17,3,13,3,38,2,13,2,11,3,12,3,12,63,13,13,74,2,31,3,40,2,11,2,12,2,11,2,25,8,37,1,14,2,17,3,11,2,20,2,14,2,14,2,14,3,28,8,14,3,11,2,11,3,17,2,11,2,12,3,11,3,11,93,48,29,54,22,1,400,NA,4/24/23 18:07,1,0,88,88,0,0,1.66,35,,,,,,,,,,,,,,,,,,,,,,,,,,,,,,,,,,,,,,,,
395,NA,SONA,interview,4/24/23 18:03,2,2,1,1,1,1,1,1,1,1,1,1,2,1,2,1,1,1,2,1,2,1,2,1,2,1,1,1,1,1,2,2,1,1,2,2,1,2,1,2,,,Looks like a 5 year old boy. ,this looks like a 6 year old boy who's been through alot. ,This looks like a 7 year old boy. ,Looks like a 5 year old girl ,This looks like a 9 year old boy looking for something. ,Looks like a 7 year old sad girl. ,Looks like a 8 year old boy. ,The little sad 8 year old girl is crying. ,Looks like a 6 year old girl. ,7 year old girl is crying. ,,A seven year old boy. ,,"Looks like a toddler, maybe 3 year old emotional little boy. ",Looks like a 5 year old boy. ,Looks like a 7 year old boy. ,,Looks like a 5 year old boy. ,,This looks like a 10 year old boy. ,,Looks like a 6 year old boy. ,,Looks like a 6 year old boy. ,This person looks like a 8 year old boy. ,Looks like a 9 year old girl. ,A 10 year old girl. ,This looks like a 9 year old thin sad boy.,,,"Looks like a baby, maybe 9 months old, a baby girl. ",Looks like a 4 year old girl.,,,this looks like an 8 year old girl,,Looks like a 5 year old girl. ,,6,6,6,5,3,4,3,3,2,2,2,4,3,3,4,4,6,5,4,6,"He probably is hungry, and sad that he can't get food. ",This person probably feels dirty because of the dirt on their face. ,,,,,,,,,,,The person in the photo is crying so they seem upset or sad. ,,"He looks very sad, crying or begging for something. ",,,,"He looks like he's in pain because he hasnt had food, and he's probably looking around to find some. ",,"This person seems upset and sad, probably didnt want any pictures taken. ",,"They are eating so they are probably hungry, they have a hospital bracelet so they can also be sick. ",,This child looks very emotional and looks like they've been crying. ,,,,,,"This person doesnt look so good, theyre probably sick or under the weather. ","He looks like he's injured or got like a shot or something medical, and is probably in pain, ",,,"He looks upset, and probably didnt ant his picture taken.","This person looks upset, like maybe sad. ",,"This little kid is crying, probably injured or hungry. ",,"He looks like he's crying for something, maybe food or attention or affection. ",Simple ,I chose decribe then feel as a pateern but then just chose random ,I think I liked to describe the most. ,"Yes, it was hard to desribe feel tho",4,3,3,5,4,4,4,2,Female,Hispanic/latino,20,4,2,3,131,21,30,38,10,12,22,4,25,15,8,28,16,32,33,13,23,5,27,1,7,31,39,3,2,29,34,6,17,40,19,11,18,35,24,14,26,36,37,20,9,8,25,1,48,2,98,2,18,3,83,17,94,14,48,5,18,3,29,2,19,9,31,2,14,4,22,2,40,2,57,9,56,4,31,5,41,2,15,4,50,3,17,9,85,3,56,5,102,7,105,3,52,2,12,3,21,4,55,17,23,5,78,2,57,30,45,252,41,7,118,1,130,2,159,2,22,12,58,4,29,1,32,304,19,33,174,3,2,915,NA,4/24/23 18:55,1,0,88,88,0,0,0.77,5,,,,,,,,,,,,,,,,,,,,,,,,,,,,,,,,,,,,,,,,
399,NA,avila,interview,4/25/23 7:12,1,1,1,1,1,1,1,2,2,2,2,2,1,2,2,2,1,2,2,2,2,1,2,1,1,1,1,2,1,2,1,2,2,1,1,1,2,2,2,1,Curious 5-6 year old boy.,Female child approximatley 5-6 years old.,This little boy is a supprised 2-3 years old,Young boy around 6 years old,Young male around 3-4 years old.,This little girl seems to be around 3-4 years old,The curious little boy seems around 3-4 years old,,,,,,This young girl appears to be around 12-13 years old,,,,A small boy around 5 years old,,,,,Young male approximatley 7-8 years old.,,a 5 year old boy,Appears to be a 2 year old girl,This young boy appears to be around 4 years old,This young child appeards to be a little boy between 3-4 years old,,The poor bored young girl around 11 years old,, A six year old boy,,,Appears to be a 2 year old girl,This boy looks to be around 3-4 years old,This appears to be a little boy around 4 years old,,,,This appears to be a young boy between 2-3 years old,4,5,3,4,5,5,4,6,5,6,3,3,4,3,4,5,3,4,6,3,,,,,,,,"Life can be very serious sometimes, but you will get through it","Bordem, beginings of the realization of what life is like sometimes","Young child appears upset, almost as if they were in a timeout",This little girls looks bored,"Young chid appears upset, possibly due to sickness or pain, or fatigue.",,Feeling of fear setteling after a traumatic event.,This seems to be the faec of a child told no,"Fear and pain, looking for reassurance",,bored while waiting for the line to move,"Distress is apparent, as is the poor physcial condition liekly adding to the discomfort seen here","Defiance or annoyance, either way they are not interested","The emotion of fatigue, bordem, and hunger",,They look annoyed at the intruptiuon of the photograph being taken,,,,,"Resignation, submission to the current events",,They look cold and bored,,Nervous about what is happening,She doesn't look like she feels very well,,,,This child appears to be tired.,"Bordem, irriatation at being told to stand for pictures when there is playing to do",This child appears to be content after receiving something to soothe,,"Tedious, and why was nearly every child crying","random, or changing when I got tired of the other deck",no,"no, almost every child was in tears",2,2,3,4,3,2,4,4,non-binary,caucasian,42,2,1,3,132,14,22,2,12,1,10,5,37,39,13,33,7,19,6,3,15,40,27,11,23,30,17,36,20,32,25,26,21,34,16,38,9,4,29,28,31,24,18,8,35,10,38,2,28,3,66,6,32,2,17,3,30,3,24,3,28,3,38,3,26,2,65,4,22,2,67,3,30,4,46,3,34,2,20,3,18,2,16,11,32,4,26,2,22,3,122,3,35,3,12,2,15,3,21,56,33,3,31,3,27,3,13,5,16,4,14,3,18,3,12,2,22,3,25,5,29,3,37,3,38,4,30,126,24,41,84,24,NA,1613,NA,4/25/23 7:42,1,0,87,87,0,0,1.07,9,,,,,,,,,,,,,,,,,,,,,,,,,,,,,,,,,,,,,,,,
407,NA,SONA,interview,4/25/23 16:01,1,1,2,2,1,2,1,1,2,1,1,2,2,1,1,1,1,2,1,1,2,2,2,1,1,2,2,1,2,1,1,2,2,1,1,2,2,1,1,2,This looks like a little boy that is about five years old.,He looks like he hasnt had water to take a bath and he looks lost.,,,This looks like a little boy that is about three or four.,,This looks like a little four year old boy that is surounded buy a burlap sack.,This looks like a boy that is about six years old.,,This looks like a little boy that is around the age of six.,It looks like a three year old little girl that is holding her scarf in her hand.,,,This looks ike a little boy that is about two years old.,This looks like a little boy going through struggles and upset and he looks about 5 years old.,This looks little boy that is about one year old.,A little five year old boy that has tears running down his face.,,This looks like a two year old boy that is very skinny and in pain.,This looks like a little boy that is around the age of three.,,,,I feel like this looks like a young boy that is probably about four years old because he just looks so young in the face.,Looks likea young one year old boy,,,she looks like a five year old girl,,This looks like a little boy that is about five years old.,This young boy looks to be about six or seven years old.,,,A young two year old boy that looks very upset.,It looks like a little three year old boy standing next to a wall.,,,This looks like a little boy that is about two years old.,This looks like a little boy that is about three or four years old.,,4,6,4,1,3,4,5,3,3,4,5,3,2,3,5,6,5,6,3,6,,,"I feel like this child is feeling shock, his face looks like he is shocked about soemthing that he has just seen.","This little boy looks sad, like hes trying to hold back tears but he can't anymore.",,She looks very sad and like she is holding back tears.,,,This little boy looks sad and lost.,,,"This child looks really sad and lost, like they are trying to figure out something.",I feel like this child is feeling sadness and is going through lots of things in thier life.,,,,,This little boy looks sad and lost like he needs some assistance.,,,This looks like a little child that has no idea all the troubles happening in the world and he looks innocent.,This little boy looks lost and like he needs some help.,He looks like he hasnt been able to take a bath for a while and that he is very hungry based on how the crumbs are on his face.,,,"This little boy looks curious, like hes trying to figure something out but cannot.","This little boy looks hopeless, like he hasn't had stability in a while.",,This person looks lost about life and trying to figure out something.,,,"This little boy looks lost, like he doesn't know what his next move is.",This little child looks very sad with those tears rolling down thier face.,,,This child looks upset and that he needs something to give him joy.,I feel like this little child has been throuhg alot in his life and he is currently sad in the picture.,,,He looks very sad and crying.,Easy,Just what I felt like picking,Yes,Not really.,2,2,3,4,3,3,3,4,Female,Native Indian,19,5,4,3,133,31,37,24,3,13,15,21,39,30,8,36,34,32,35,11,9,17,7,19,26,4,27,33,25,40,2,28,6,23,38,22,14,5,12,1,16,29,10,18,20,1639,96,3,22,5,36,3,39,2,29,3,100,4,32,40,88,3,25,3,17,16,76,4,56,3,44,3,40,4,173,522,56,4,54,3,27,3,21,16,140,6,17,4,44,4,23,4,37,3,43,4,151,3,34,3,34,963,415,4,35,4,20,4,33,3,38,27,29,874287,49,33,20,3,40,4,42,12,23,4,20,4,256757,67,27,26,74,8,2,801,NA,5/8/23 19:50,1,0,88,88,0,0,0.66,2,,,,,,,,,,,,,,,,,,,,,,,,,,,,,,,,,,,,,,,,
409,NA,avila,interview,4/25/23 20:13,1,2,1,2,2,1,2,1,2,2,2,2,1,1,2,2,1,1,1,1,2,2,2,1,2,2,1,2,2,1,2,2,1,2,1,1,2,2,1,2,LOOKS LIKE A 9 YR OLD MALE ,,shocked little 5 yr old boy,,,sad 3 year old female. ,,sad,,,,,very sad 15 yr female. ,scared little 6 yr old. ,,,sad,lost,hurting 5 yr oold boy,3 YR OLD BOY FEELING DIRTY AND HUNGRY. ,,,,wondering what you are thinking. ,,,LOOKS HUNGRY AND SAD.,,,"feels very misserable, 10 yr old boy. ",,,why are they all black,,LOOKS LIKE A 4 YR OLD BOY ,feels hopeless. ,,,just finished crying.,,7,5,4,4,1,3,3,3,3,5,3,7,4,3,5,3,3,3,5,3,,blank,,upset and sad,very very sad,,shy,,"HAS HAD A ROUGH CHILDHOOD, FEELS NEGLICTED. ",just miserable. ,mad,PAIN.,,,feels pain alot of it. ,PAIN SCARED. ,,,,,sad,DEOS NOT KNOW WHAT HE FEELS. ,very hunrgy and dirty,,HURT.,sad,,lost.,mad ,,sick,confused,,feels hurt sad. ,,,shy,didnt get what he wanted,,stressed,to many of the same questions. ,feel,yes ,not much. ,2,2,4,3,4,3,5,3,male,hispanic,30,4,3,5,135,25,12,27,1,35,9,22,16,20,28,33,39,18,31,32,11,26,4,38,5,10,17,23,6,37,40,29,21,7,2,19,3,24,30,36,34,8,15,13,14,8,2,3,31,6,11,3,14,5,19,100,11,6,12,59,11,4,11,2,41,4,12,162,12,3,12,3,12,2,12,2,11,87,12,3,11,6,11,4,11,51,27,5,12,30,29,4,11,5,11,16,25,139,11,3,17,949,11,46,20,2,20,6,11,47,11,7,11,2,11,2,22,3,12,2,35,7,11,4,14,3,14,85,28,68,111,16,NA,1082,NA,4/25/23 20:58,1,0,87,87,0,0,1.37,31,,,,,,,,,,,,,,,,,,,,,,,,,,,,,,,,,,,,,,,,
413,NA,SONA,interview,4/26/23 17:07,1,1,1,1,2,2,1,1,1,1,2,2,1,1,2,1,1,1,1,2,1,1,2,2,2,1,2,1,1,2,1,2,2,2,1,1,2,2,1,2,6 year old boy ,7 year old boy ,this is a 4 year old boy ,4 year old boy ,,,This person looks like a 4 or 5 year old little boy. ,this person looks like a 3 or 4 year old little boy ,3 year old boy ,This person looks like they are 7 or 8 year old little girl. ,,,8 year old boy ,This person looks like a 4 or 5 year old little boy ,,This looks like a 2 year old little boy ,This person looks like a 4 or 5 year old little boy ,this looks like a 9 year old little boy,This person looks like a 3 or 4 year old little boy ,,this looks like a 3 year old boy ,5 year old boy ,,,,3 or 4 year old boy,,This person looks like a 6 or 7 year old little girl. ,This person looks like a 9 or 10 year olf little girl. ,,This person looks like a 8 or 9 year old little boy ,,,,This looks like a 4 year old little boy ,This looks like a 4 or 5 year old little boy ,,,This person looks like a 5 or 6 year old little boy ,,4,4,4,4,2,5,4,3,5,5,3,6,4,6,4,3,5,4,5,4,,,,,This person looks very upset and maybe scared ,this person looks upset ,,,,,this person looks scared ,looks upset ,,,this person loos very upset,,,,,this person looks like they were maybe playign before this picture was taken ,,,This person looks upset and maybe hungry ,This person looks like they are thinking about something ,This person looks sad or upset. ,,looks neutral,,,looks upset ,,This person looks kind of scared or maybe unaware of what is going on. ,this person looks upset ,This person looks very sad and upset ,,,looks upset ,This person looks upset ,,This person looks upset ,repetative ,randomly ,no ,not really ,3,2,2,3,4,3,4,3,female,white ,19,4,2,4,137,28,32,7,29,25,34,10,14,5,31,39,24,38,19,36,40,23,17,8,16,35,15,18,20,6,21,33,3,11,1,27,26,22,37,4,9,30,2,13,12,4,1,2,11,3,11,2,12,3,11,3,13,2,12,5,44,3,40,4,11,2,30,2,16,2,11,3,11,34,20,2,11,2,14,3,18,3,12,84,16,2,27,3,15,2,11,2,33,3,15,2,18,2,12,4,46,5,33,38,22,2,11,8,25,3,32,4,11,10,13,2,12,19,14,2,12,3,11,3,34,2,11,79,19,43,117,26,3,511,NA,4/26/23 17:29,1,0,88,88,0,0,1.4,25,,,,,,,,,,,,,,,,,,,,,,,,,,,,,,,,,,,,,,,,
414,NA,SONA,interview,4/26/23 17:08,1,1,1,1,2,1,1,1,1,2,1,1,1,1,1,1,1,1,1,1,1,1,1,1,1,1,1,1,2,1,1,1,1,1,1,1,1,1,1,1,Five year old boy,Eight year old girl,Three year old boy or girl,Roughly five year old boy.,,A three year old girl,Four year old boy,Four year old girl,Five year old boy,,Four year old girl,A nine year old girl,An eleven year old boy or girl,A four year old boy,"Seven years old, a boy.",A two year old boy,Four year old boy,8 year old boy,Four year old boy,Three year old boy,One year old boy or girl,a six year old boy,Four year old boy,A four year old boy,One year old gilrl,Two year old boy,Six year old boy.,A seven year old girl,,A four year old boy,Seven year old boy or girl,Six year old boy,One year old girl,"A two year old, could be boy or girl",Three year old boy,three year old boy,Three year old boy or girl,One and a half year old boy,A three year old boy,Two year old boy,3,6,4,5,2,2,5,4,3,5,4,4,3,6,2,4,4,5,1,3,,,,,Seems like they are upset about not having something.,,,,,"They have just finished crying, probably getting over saddness",,,,,,,,,,,,,,,,,,,sad,,,,,,,,,,,,Repetitive,The one I could describe better,Describe,Some,3,2,1,4,4,5,3,2,Female,Caucasian,19,5,3,4,138,29,4,10,15,27,5,12,24,6,39,14,34,16,30,22,28,13,1,11,17,33,23,2,40,36,32,9,7,35,31,20,37,38,18,8,3,25,19,21,26,6,6,2,15,2,21,2,73,3,37,2,66,2,12,2,11,5,13,2,15,2,73,3,14,3,44,3,21,2,12,3,46,2,11,2,13,2,20,2,13,3,17,2,13,5,18,3,22,5,14,3,20,2,12,2,21,2,26,9,16,4,13,2,16,3,13,2,11,2,29,2,17,3,12,3,22,4,19,2,12,3,12,211,24,31,97,2,3,573,NA,4/26/23 17:31,1,0,88,88,0,0,1.28,18,,,,,,,,,,,,,,,,,,,,,,,,,,,,,,,,,,,,,,,,
421,NA,avila,interview,4/27/23 15:23,2,2,1,2,2,2,1,1,2,1,1,1,1,2,1,2,1,1,2,1,1,1,2,1,1,1,2,1,1,1,1,1,1,2,2,1,1,2,2,2,,,seeing a popscicle and is excited,,,,this kid is about 6 years old and identified as a boy,Hungry and struggling with hunger,,5 and girl,3 year old girl,boy 4 y.o.,"girl, 9",,boy 6,,3 year boy,"boy, 7 years old",,girl. and 3 years old,"girl, 1 year 6 months",4 boy,,"boy, 4 years old",1.5 year old girl,boy and 3 years old,,"girl, 6","girl, 9 years old","boy, 7",8 girl,5 boy,"girl, 9 months",,,tired,8 year old boy,,,,1,6,2,2,1,6,7,1,7,3,7,2,6,6,1,4,4,6,1,2,mad cause he wants a ball,pissed cause of school. can't play,,worried about who the camara operator is,he just got stung by a wasp and so is in pain,this kid wants a toy but is getting over it cause is just greedy and wants just to want,,,"bored and waiting in line, trying to behave",,,,,scared of shots,,sad cause his mom had to walk away,,,scared of shots,,,,eating after a good soccor game,,,,"thirsty, but wanting to play, kinda iratated has to stop playing",,,,,,,sad cause his toy was taken away,shy,,,getting over not getting a 2nd cookie,"happy, but shy of new people",hurt from the splinters,"repetitive, why were those pictures taken?","50/50, til it got to a point what was quicker to answer",describe. quicker,none,4,4,2,5,2,3,2,5,alpha male,white,29 years young,3,1,2,139,8,34,7,16,20,14,33,6,18,5,26,9,39,29,27,21,24,35,17,4,10,31,15,1,32,22,23,13,28,19,2,36,11,30,12,40,38,3,25,37,72,4,6,213,4,18,3,20,4,513,23,25,10,56,4,40,11,24,2,31,4,24,21,32,13,82,46,12,4,17,3,37,3,28,29,92,3,21,14,26,5,15,4,17,9,16,3,28,8,25,3,22,2,15,8,46,5,26,10,18,4,12,2,12,13,124,3,13,4,75,7,36,8,83,3,12,4,27,4,27,4,22,101,42,118,220,NA,NA,1699,NA,4/27/23 16:11,0,0,86,86,0,0,0.91,10,,,,,,,,,,,,,,,,,,,,,,,,,,,,,,,,,,,,,,,,
422,NA,avila,interview,4/27/23 17:40,1,2,1,1,1,2,2,1,2,1,2,2,2,1,1,1,1,2,1,1,1,1,2,1,2,1,2,1,2,2,1,1,1,2,1,1,2,1,1,1,9 year old boy ,,2 year old boy ,6 year old Male ,male 6 years old ,,,male 10,,female 9,,,,3 year old male ,6 year old male  ,infant female ,8 year ole male ,,toddler under fed male ,4 year old male ,infant or early toddler years male ,9 year old Male ,,male 5 ,,2 year old male ,,Female 7,,,ill 7 year old male ,7 year old male ,Female infant ,,4 year old boy ,6 year old boy ,,Male 18 months old ,3 year old male ,male 4 years old ,3,7,2,2,3,1,1,1,7,7,1,3,5,7,1,6,7,7,4,1,,looks like he was playing and was disrupted by someone to take a photo annoyed and irritated ,,,,determined and dissapointed ,peek a boo I see you playing around and curious ,,"His looks are sadness, defeated, hopelessness. ",,"why are you looking at me, annoyed, and ready to get back to what they were doing prior to being stopped ",just got hurt and is being comforted ,Looks like he may have just gotten in trouble and is embaressed and upset ,,,,,looking to see what someone was doing ,,,,,Sadness and the feeling of being alone. ,,an infant that was upset about something and who ever comforted them found the cause and resolved it either with food or holding them,,Looks as if he just finished lunch at school and is annoyed someone is taking a photo of him ,,exhausted and tired maybe woke up to early for class or to do chores ,cold and annoyed ,,,,just got hurt and being comforted by another person ,,,Comfort from his mother or the woman in the photo that he is leaning against ,,,,It was different. Trying to figure out how and what was going on in the photo some of it seemed staged ,I just randomly picked between decks ,no preference I think I picked the discroption deck the most just out of color preference ,I felt like the only differences was what you were answering ,2,2,2,5,4,3,3,5,Female ,White,34,4,1,7,140,9,38,40,27,33,4,22,37,23,14,20,13,15,16,17,19,39,5,32,30,6,8,10,24,28,31,7,34,25,11,29,12,1,36,35,3,21,2,18,26,5,2,2,11,2,27,2,14,2,13,3,11,2,44,2,16,2,13,9,50,2,12,1,24,2,18,3,114,6,68,2,12,2,15,2,12,2,19,2,16,3,11,2,12,2,12,2,37,2,12,2,35,2,11,2,39,2,12,2,17,2,13,3,13,2,12,3,14,2,18,2,11,2,12,2,33,7,26,2,11,3,30,126,23,34,127,3,NA,1220,NA,4/27/23 18:02,1,0,87,87,0,0,1.57,36,,,,,,,,,,,,,,,,,,,,,,,,,,,,,,,,,,,,,,,,
