192,NA,avila,interview,4/14/23 2:26,1,2,2,1,2,1,2,1,2,2,2,2,1,1,1,1,1,2,1,1,1,2,2,1,2,2,2,1,1,2,1,1,1,2,2,2,2,1,1,2,"This thin boy with big brown eyes appears to be about 7, but his hollowed chest shows he may be hungry. ",,,"This child of about 5 years old appears to be male. I see a tear running down his left cheek, although he does not appear to be sobbing or opening sad. ",,"This girl of about 4 years old has carefully parted hair and earrings, as well as a warm looking sweater, but she has been crying as shown by the tear streak on her face. ",,This girl of around 7 has snot dripping from her nose and tear marks on her face from both eyes. ,,,,,"This teenaged girl is crying, with tear streaks running down her face, and her eyes are downcast.",This toddler boy is wearing a blue and white striped shirt and has tear stains on his face and a furrowed brow. ,This young boy has tears running down his face and appears to have scars on his chest. ,This todder boy is crying and his wide eyes and down turned mouth show that he may be anxious about something. ,"This 7-8 year old boy has tear streaks running down both sides of his face, as he looks seriously at the camera with swollen eyes. ",,"This young toddler girl is starving to death, as shown by the emaciated chest, withered arms, and pained grimace. ","This 5 year old boy is tilting his head as he looks at the photographer, with his shirt mostly unbuttoned and his hands on the wall behing him. ","This wide eyed tot is being held by a loved one, but the child doesn't show an expression of joy or comfort, rather apathy or fatigue.",,,This young boy is probably around 6 years old and he is curious about the photographer as he sits with his head resting on his arms. ,,,,This school age girl with facial scars is being held by her mother as she gazes at the camera with a serious look with her beautiful green eyes. ,This 10 year old boy is holding his head up with his hand and has dirt on his face. ,,This elementary age girl is wearing a blue outfit and looks at the camera with a serious gaze. ,This 4 year old boy wearing a plaid shirt is receiving medical treatment and is being held by adult hands. ,This infant girl is wearing a cap and appears very tired and has been crying. ,,,,,"This bare chested baby boy is quietly crying, but he sits quietly for the photo. ","This very young child of perhaps 3 or 4 may be either a girl or boy and is crying, without showing overt emotion. ",,1,7,2,2,6,3,1,3,4,5,1,2,6,6,2,5,5,7,5,2,,This boy is suspicious of the photographer and is a bit belligerant about posing for a photo. ,This child is astonished at what is being down as strong hands hold him. ,,"This young girl is heartbroken, crying opening with reddened eyes, as she suffers a great loss in her life. ",,"He is a bit afraid, but mostly curious about the person looking at him. ",,This young boy is feeling very sad and hopeless about his situation. ,"This young child is overcome with sorrow and is crying a great deal, to the point that their nose is running too. ",This young girl is uncertain about what is going on and a bit apprehensive about why the photographer is so close to her. ,"This child is profoundly sad, perhaps after the death of a loved one, and even her mother's arms do not deliver comfort. ",,,,,,"This young boy seems tired, perhaps a bit out of it with his blank stare, as though he is overwhelmed by his life. ",,,,"This young girl feels alone and captive, as she stands behing wire in a refugee setting; she shows no overt emotion as she may have moved into hopelessness. ","This young boy is not loving the taste of the food he was given, but is aware of the need to eat the food no matter how it tastes. ",,"This baby is unhappy, perhaps after having been given a shot. ",This boy is tired and ill and must hold his head up as he wonders why he is the subject of a photo. ,"This boy is feeling serious, but not sad, perhaps wondering after his meal when the next meal will come. ",,,"This small child is cold and unhappy, trying to find warmth and comfort in the ragged blanket around it. ",,,,"This tot is unhappy and is seeking comfort from the adult to his left, as he leans into her. ",This child is feeling bashful - uncertain about why this person is photographing him and not sure at all that he likes it. ,"She is very solemn, thinking very serious thoughts about her future in the world. ","This child is sad, but not overly so, as they have a blank expression with tears leaking out of her eyes. ",,,This little boy is distrustful of those around him and is sad for his circumstances. ,Hard and repetitive,"I tried switching evenly at first, then stuck with one for awhile, then the other. ","I thought I liked feeling better, but later discovered I did a better job on the observing deck.  Then feelings started entering on that one. ",Lots of sad African kids in both. ,3,4,4,3,3,4,4,3,Female,White,65,2,3,7,53,7,35,4,18,39,9,19,5,21,11,13,23,36,6,16,17,27,25,31,15,28,24,2,10,33,29,14,8,34,37,38,20,1,32,22,26,3,40,30,12,9,29,4,69,3,38,4,28,5,85,5,40,2,63,8,32,3,37,4,31,3,39,2,42,2,35,3,66,3,39,3,37,3,41,4,45,7,60,4,57,2,48,4,57,2,62,3,59,3,40,3,34,2,37,4,43,3,70,5,76,4,31,3,38,4,41,5,45,2,40,5,40,3,37,2,35,2,50,4,99,2,25,117,16,15,52,12,NA,2207,NA,4/14/23 3:04,1,0,87,87,0,0,0.89,6,,,,,,,,,,,,,,,,,,,,,,,,,,,,,,,,,,,,,,,,
194,NA,avila,interview,4/14/23 2:33,1,2,1,1,1,2,1,1,1,2,1,1,1,1,2,2,1,1,2,2,2,1,1,1,1,2,2,2,2,2,1,1,2,1,2,2,2,2,1,1,This is a boy aged 10 years old.,,This is a boy around the age of 6 years old.,This child look like a boy around 8 years old.,This is a picture of a 5 year old boy.,,This is a boy aged 6-7 years old.,This is a girl aged 9 years old.,This is a boy and he is 10 years old.,,The child is a female and about 4-5 years old.,This person look like a girl around 8-9 years of age.,This is a boy around the age of 14-15 years old.,This is a boy that is 3-4 years old.,,,This is a boy aged 7.,This is a boy aged 8-9 years old.,,,,This is a picture of a 12 year old boy.,This is a boy that's around 5-7 years old.,Gender is a boy and age is 6 years old.,This is a boy aged 2 years old.,,,,,,This is a girl around the age of 6-7 years old.,This is a girl around the age of 9 years of age.,,This is a girl age 5 years old.,,,,,This is a boy aged 5 years old.,This is a boy that is 4 years old.,2,7,2,4,1,1,2,3,2,7,5,5,2,7,4,4,7,3,4,3,,The child seems to look a little irritated.,,,,This little girl is sad.,,,,This little girl look as if somebody told her some bad news that she's trying to process.,,,,,This child look as if he is stressed.,"This child is very sad. Perhaps, not getting what she want?",,,This child seem to be hurting. He's very malnourished and is in pain.,It look like this child has no worries. He look as if he is trying to figure out why that person is taking the picture.,This child look very scared.,,,,,This child look a little sad & lost.,I feel as if this child is broken. The child may have experienced some trauma.,"This child look like she has seen a lot but, she's better now!",This child looks hot and thinking.,This child appear to be homeless and it look as if he is worried.,,,This child has a worried look in his/her eyes. ,,The child look lost.,This child look like he is thinking/focusing.,This child look slightly scared & worried.,This child is crying and he look like he has had a very hard time.,,,Very repetitive. ,I alternated between the decks.,Yes,Slightly.,2,2,5,5,5,4,5,4,Female,African American,25,4,4,1,54,27,22,6,5,38,23,9,24,4,12,40,34,32,2,20,18,33,25,19,21,30,10,17,16,14,15,1,39,37,8,36,28,11,35,13,3,29,7,31,26,11,3,25,29,3,30,17,51,2,127,3,104,3,42,2,51,7,26,3,58,2,28,4355,76,4,27,4,21,2,70,34,25,2,45,9,15,3,35,2,25,3,61,2,24,8,82,2,93,3,20,3,17,5,178,9,69,3,104,3,118,2,41,15,116,4,32,3,55,3,111,3,211,138,29,4,33,3,119,56,27,9,21,89,23,46,94,21,NA,1855,NA,4/14/23 4:38,1,0,87,87,0,0,0.82,7,,,,,,,,,,,,,,,,,,,,,,,,,,,,,,,,,,,,,,,,
196,NA,avila,interview,4/14/23 2:46,1,1,2,2,2,2,2,2,1,1,2,1,1,1,2,1,1,1,1,2,1,1,1,2,1,1,1,1,2,2,1,1,1,2,2,2,1,2,2,1,6 year old boy.,9-year-old girl.,,,,,,,8 year old boy.,This person appears to be a boy about 3 years old.,,4-year-old girl.,15-year-old girl.,2-year-old boy.,,10 month old boy.,3-year-old boy.,10-year-old boy.,"A 1-year-old, possibly 2-year-old boy.",,1-year-old boy.,10-year-old boy.,3-year-old boy.,,This person appears to be a 1 year old girl.,2 year old boy.,7 year old boy.,6-year-old girl.,,,6 year old girl.,This appears to be a 4 year old boy.,7-month-old girl.,,,,3-year-old boy.,,,3 year old girl.,4,5,3,3,2,2,2,3,4,6,2,5,6,6,2,6,-9,7,6,5,,,"This baby might feel scared, confused, while also not feeling well/sick. ",Confusion and curiosity about the visitors they see in front of them.,"Sad and upset, while also frustrated that someone is watching them.","Sadness, tiredness, perhaps itchiness due to their skin condition.","Irritation at being watched, shyness.","Sadness, frustration.",,,"She looks hungry, quietly taking in her surroundings.",,,,"Hungry and tired, and wondering what the people in front of them are doing.",,,,,"This person might feel confusion for why the people photography them is there, perhaps curiosity.",,,,"Boredom while waiting for the next thing, curiosity about the people across from him.",,,,,"Tiredness, exhaustion.",This person perhaps feels hunger and tiredness.,,,,Tired and hungry.,"Shyness, tired, confusion.","Frustration, confusion.",,"Tired and wanting a nap, but also feeling the pangs of hunger.","Sadness, but also intrigue in whoever they are watching photograph them.",,It was a little depressing seeing so many sad little faces.,At first I kind of just went back and forth,"Yes, it was easier to quickly assume ages and genders",The pictures between the two decks seemed overall similar.,3,2,3,4,4,4,4,3,Female,White,30,6,4,5,55,10,30,32,25,20,6,27,9,1,31,36,29,26,40,3,5,34,19,17,39,38,21,33,16,24,7,22,12,35,2,28,4,37,23,15,8,13,18,11,14,74,256,2,13,3,13,2,68,6,27,2,29,5,56,2,35,2,18,2,18,6,67,7,43,2,14,2,12,5,12,4,34,9,12,2,12,2,11,2,30,3,50,3,21,4,18,2,22,2,26,2,27,4,12,2,11,2,26,2,44,8,59,2,33,3,43,3,21,2,16,2,30,2,32,3,12,2,42,1,26,1,24,163,32,103,260,40,NA,1797,NA,4/14/23 3:22,1,0,87,87,1,1,1.22,18,,,,,,,,,,,,,,,,,,,,,,,,,,,,,,,,,,,,,,,,
200,NA,avila,interview,4/14/23 3:35,2,1,2,2,2,2,1,2,2,2,1,2,1,1,2,2,1,2,2,2,1,1,2,2,1,1,2,2,2,1,1,2,2,2,1,2,2,2,1,2,,8 or nine and a boy,,,,,5 boy ,,,,3 or 4 girl,,12 boy,4 boy,,,4 or 5 boy ,,,,2 boy,4 or 5 boy,,,18 months boy,3 boy,,,,6 boy,6 boy,,,,4 boy,,,,2 boy,,7,2,6,4,2,5,4,4,2,5,1,5,5,5,2,2,6,6,4,5,Done playing and is being spoken to about something ,,Day dreaming or surprised,Realization and observation ,Reprimanded and frustrated ,Consequential and understanding ,,Upset and is realizing something. Or letting something upsetting settle in emotionally ,He appears to be waiting or is unsure of time,Disappointment ,,Reprimanded and content after the fact and is disappointed ,,,More like a painful memory ,The kid can't get what he wants and is frustrated by the outcome or response he got,,Waiting or bored,Misunderstands and is in pain,Content curious shy,,,Unsure why he is being photographed ,Person feels content and curious almost observant ,,,Irritated ,Content or curious ,Boredom ,,,Doesn't understand and is a tad frustrated ,They look like they are done crying over something stupid like dropping milk bottle,Sadness ,,Understanding or misunderstanding ,Frustration and realization ,Content and upset,,Not included ,Uncomfortable ,Randomly ,Yes blue,Yes the task,2,3,3,3,2,3,3,3,Female ,Black,29,4,3,1,56,16,2,17,24,8,9,22,33,21,18,28,25,15,37,35,36,10,4,13,14,40,20,30,1,12,27,7,3,5,38,29,34,11,39,32,19,26,6,23,31,10,15,3,22,10,47,3,16,2,17,4,12,2,27,4,11,2,54,2,31,2,11,2,15,2,32,2,17,4,11,2,38,12,64,4,53,2,12,3,17,2,11,3,11,3,24,2,23,4,47,2,18,5,16,2,11,2,18,7,11,3,14,3,14,2,28,2,52,2,11,2,12,2,18,3,18,2,11,3,14,2,23,120,38,81,198,7,NA,1490,NA,4/14/23 4:00,1,0,87,87,0,0,1.37,23,,,,,,,,,,,,,,,,,,,,,,,,,,,,,,,,,,,,,,,,
201,NA,avila,interview,4/14/23 3:53,1,1,1,1,2,1,2,2,2,1,1,2,1,1,2,2,1,2,1,1,1,1,2,1,1,2,1,1,1,2,1,1,1,2,2,2,2,2,1,1,Male  age 6,Make age 7,Make age 3,Male age 4,,Female age 3,,,,Male  age 5,Female age 4,,Male age 12,Male age 4,,,Male age 4,,Male age 5,Female age 3,Female age 2,Male age 5,,Male child watching television ,female age 2,,Male age 6,Female age 6,Female age 10,,Make age 5,Male age 6,Male age 1,,,,,,Male age 4,Make age 3,7,7,5,5,5,2,1,1,7,7,1,4,7,7,2,7,7,7,7,2,,,,,Little boy caught off guard ,,Young black child hiding,Little girl very sad,Little boy feeling trapped ,,,Little girl wanting friends ,,,Little boy stress,Young child crying for food,,Young black boy very tired ,,,,,Little boy hunger ,,,Little boy confused ,,,,Little boy very cold,,,,Little boy missing his mom,Little boy just got in trouble ,Little boy very mad,Little boy angry,Male age 2,,,Very long,Just guessed ,Yes,No,3,3,1,5,2,1,1,5,Female ,Black American ,49,2,4,4,57,8,27,11,7,20,2,4,16,28,24,38,35,21,12,33,32,18,25,22,30,14,31,36,3,10,23,15,26,39,13,6,19,9,17,40,34,37,1,29,5,8,5,3,16,2,15,3,14,3,20,2,17,2,22,3,45,24,31,2,16,2,23,3,21,1,19,2,13,2,11,2,14,6,37,3,11,2,21,2,11,2,18,2,16,2,18,2,14,10,29,5,35,1,17,4,30,2,11,3,14,1,18,2,12,2,14,2,14,4,16,1,23,1,15,2,21,2,14,3,11,2,14,80,43,49,99,4,NA,1142,NA,4/14/23 4:12,1,0,87,87,0,0,1.56,32,,,,,,,,,,,,,,,,,,,,,,,,,,,,,,,,,,,,,,,,
204,NA,avila,interview,4/14/23 4:01,1,1,1,1,2,1,1,2,2,1,1,1,1,1,2,1,2,1,1,2,1,2,1,1,1,1,1,1,1,1,1,2,2,2,2,1,1,1,1,1,Five year old male,Seven year old male,Two year old male,Five year old male,,Three year old female,Three year old male ,,,Five year old male,Three year old female,Six year old female,13 year old male,Two year old male,,One year old male,,Six year old male,Five year old male,,Two year old male,,Five year old male,Five year old male,Two year old male,Two year old male ,Six year old male,Five year old male,8 year old female ,Seven year old male,Six year old male,,,,,Three year old male,Three year old male,Two year old male,Three year oldmale,Two year old male,5,3,5,6,2,2,6,3,3,6,4,6,3,5,3,2,5,2,2,6,,,,,He is feeling sadness ,,,Little one is hurt and sad,The young man is angry and sad,,,,,,He is feeling abused ,,This little one is sad,,,I see resilience ,,The young male is feeling alone,,,,,,,,,,He is scared,Little one is not feeling well,This little one is saddened ,This little boy is feeling unsure and distrusting ,,,,,,Emotionally tiring ,Random,Yes,No,5,5,5,4,5,5,4,4,Female,African American ,57,2,4,4,58,9,32,17,34,25,7,22,2,8,33,35,20,5,15,3,6,4,27,24,40,21,1,16,13,11,14,36,29,18,28,30,12,19,38,39,23,31,37,10,26,87,1234,4,15,5,59,4,37,4,21,3,68,3,42,3,42,3,36,17,86,2,17,9,27,2,27,3,24,3,18,6,49,2,13,4,33,5,24,2,19,3,54,3,20,16,74,2,85,3,19,3,60,3,18,2,27,3,32,2,21,2,26,2,19,3,56,3,40,4,26,5,76,2,18,8,17,2,13,3,18,3,31,183,77,77,205,33,NA,2137,NA,4/14/23 4:59,1,0,87,87,0,0,0.96,8,,,,,,,,,,,,,,,,,,,,,,,,,,,,,,,,,,,,,,,,
207,NA,avila,interview,4/14/23 4:19,1,2,2,2,2,2,1,2,2,2,2,2,2,1,2,2,1,2,2,2,1,1,2,2,2,2,2,2,2,2,1,1,2,1,1,1,1,1,1,1,This is a 5 year old boy,,,,,,This is a 2 year old boy,,,,,,,This is a 2 year old boy,,,This is a 4 year old boy,,,,This is a 1 year old girl,This is an 8 year old boy,,,,,,,,,This is a 7 year old boy.,This is a 4 year old boy.,,This is a 3 year old girl,This is a toddler boy. ,This is a 4 year old boy,This is a 3 year old girl,This is a 2 year old girl,This is a 4 year old boy,This is a 2 year old girl,4,4,4,4,4,3,3,3,7,7,4,4,6,6,4,4,5,7,7,4,,This person is lonely and sad,This person is scared,This child is curious,This child is scared and sad. ,This child needs love,,This is a 6 year old girl,This child is tired of struggling ,This child is sad and desperate ,This person is very Leary .,This person feels hopeless. ,This person feels loss and grief. ,,This child is sad and tired ,This person is very untrusting ,,This child has a lot on his mind,This person is painfully hungry. ,This is a curious boy,,,This person is angry,This child is worried,This person has been sad for a while.,This is a tired boy,This person is very sad and full of hurt.,This person is very serious,This child is untrusting ,This person is cold,,,This child is sad and tired,,,,,,,,Kind of hard,I just tried to mix it up,No,Yes,3,3,1,2,3,3,2,2,Female,White,50,3,2,4,60,27,35,25,32,19,11,12,31,13,3,40,28,16,39,23,9,38,1,30,8,2,33,22,5,29,4,7,34,15,14,37,26,20,21,17,10,24,6,18,36,6,28,3,25,4,43,2,34,3,23,3,31,2,24,3,18,3,27,3,32,2,22,3,60,278,29,2,26,3,23,2,59,2,39,3,24,5,29,3,56,3,21,2,24,3,27,3,23,3,26,4,68,2,35,6,90,9,80,3,28,3,19,5,37,3,62,3,44,4,43,7,56,2,18,2,18,3,19,3,35,2,26,137,73,88,145,24,NA,2047,NA,4/14/23 4:58,1,0,87,87,0,0,0.97,6,,,,,,,,,,,,,,,,,,,,,,,,,,,,,,,,,,,,,,,,
208,NA,avila,interview,4/14/23 4:48,1,2,1,1,1,2,1,2,1,1,2,2,1,1,1,1,1,2,1,1,1,2,1,1,1,1,1,2,1,1,1,2,1,1,2,1,1,1,1,1,This boy is about 12 years old.,,This young boy is about 1 year old.,This young boy is about 7 years old.,This young boy is about 2 years old.,,This young boy is about 4 years old.,,This boy is about 8 years old.,This young boy is about 10 years old.,,,This boy is about 14 years old.,This young boy is about 4 years old.,This young boy is about 8 years old.,This young girl is about 3 years old.,This young boy is about 5 years old.,,This young boy is about 10 years old.,This young boy is about 2 years old.,This young boy is about 2 years old.,,This young boy is about 8 years old.,This young boy is about 5 years old.,This young boy is about 2 years old.,This young boy is about 2 years old.,This young boy is about 5 years old.,,This young lady is about 12 years old.,This young boy is about 7 years old.,This young boy is about 12 years old.,,This young girl is about 1 year old.,This young boy is about 5 years old.,,This young boy is about 12 years old.,This big is about 5 years old.,This young boy is about 3 years old.,"This youn boy, about 3 years old, is kicked back and relaxing",This young boy is about 2 years old.,5,6,6,4,2,2,2,2,6,7,2,5,7,3,3,3,6,7,4,5,,This young person is sad because he worked very hard to have his work destroyed by others.,,,,This young girl is sad because her dog ran away.,,Something very bad happened to cause her sadness,,,She is u sure about who she is and how to proceed.,This young boy is sad because he lost his dad.,,,,,,This young person is longing for food and drink.,,,,This young person is anxious and not sure what will happen next.,,,,,,This young person is confused about what is happening.,,,,This young boy is confused about why he got in trouble.,,,This young boy is longing to be loved and part of a family.,,,,,,Depressing seeing all the sad pictures.,Started switching between the decks and then felt it was easier to answer describe deck.,Yes towards the describe deck.,The way I thought about each deck was different.,2,2,1,4,4,4,3,4,Female,White,45,4,3,5,61,8,39,18,22,29,28,20,9,35,16,14,19,12,11,36,26,24,15,32,6,38,34,31,30,17,13,33,7,23,2,4,27,25,3,21,5,40,10,37,1,13,43,3,12,3,71,2,16,3,12,2,21,2,16,3,12,4,27,3,12,6,22,3,20,3,64,3,11,5,15,3,13,2,41,5,11,3,34,2,15,7,18,2,16,3,35,2,11,2,12,2,12,2,24,3,16,2,28,3,30,3,13,2,11,2,25,2,17,3,11,5,31,2,13,2,14,1,16,4,33,2,15,146,33,24,125,17,NA,1363,NA,4/14/23 5:10,1,0,87,87,0,0,1.38,23,,,,,,,,,,,,,,,,,,,,,,,,,,,,,,,,,,,,,,,,
219,NA,avila,interview,4/14/23 14:53,2,1,2,2,2,2,2,2,2,2,2,2,2,2,2,2,2,2,2,2,2,2,2,2,2,2,2,2,2,2,2,2,2,2,2,2,2,1,1,2,,A young boy maybe 8 years old. Looks to be wearing very little clothing and hasn't bathed in quite some time,,,,,,,,,,,,,,,,,,,,,,,,,,,,,,,,,,,,This is a young child maybe 4 years old,A young boy maybe 5 years old appears to be sad,,3,5,2,2,2,2,2,2,4,6,2,4,5,4,2,5,7,6,5,6,They are feeling abandoned and untrusting,,They are feeling shocked ,They are feeling anger,They are feeling very sad and angry,They are feeling like they are not sure what is going on,They are feeling suspicious,They are feeling sad with some anger,They are exhausted and worried,They are feeling betrayed and neglected,They are feeling unsure,They are feeling sad and doesn't know what will happen to them,They are feeling sad and worried,This child is experiencing fear.,They are feeling sad and exposed,This young child is feeling scared and sad,They are feeling angry and upset,They are feeling worried,"They are feeling pain, hunger, and fear",This young child feels indifferent,They are feeling exhausted and starving,They are feeling worried,They are feeling untrusting,They are feeling hopeful but sad,This child is sad and needing help,They are feeling exhaustion and confusion,They are feeling sad and hurt,They have been through many difficult times for as young as they are,They are feeling exhausted and hopeless,They are feeling helpless ,"They are feeling exhausted, worried and hopeless",They are feeling scared and worried,They are feeling sad,They are feeling scared and worried,They are feeling untrusting,They are feeling sad,They are feeling guarded and untrusting,,,They are feeling abandoned and neglected,It was an interesting process,Chose what ever felt right,Chose feel the most,Yes,3,2,1,5,3,2,1,5,Female,White,37,2,1,4,66,14,38,25,21,9,28,40,16,30,2,37,17,10,24,20,19,33,23,15,11,18,12,39,34,1,36,8,29,13,6,27,3,7,35,31,32,4,26,5,22,36,78,2,17,2,56,2,11,1,11,2,14,2,19,2,12,2,15,3,22,2,21,2,11,2,38,1,11,5,41,1,12,5,21,2,32,2,12,2,20,2,21,2,33,2,11,2,13,2,21,3,32,2,16,1,12,2,39,2,14,2,22,2,16,1,13,2,13,1,15,1,14,2,22,2,21,4,30,2,32,1,25,92,23,39,99,16,NA,1296,NA,4/14/23 15:15,1,0,87,87,0,0,1.61,34,,,,,,,,,,,,,,,,,,,,,,,,,,,,,,,,,,,,,,,,
236,NA,avila,interview,4/14/23 17:01,1,1,2,1,1,2,2,1,1,1,1,1,1,1,1,1,1,2,1,1,2,1,1,2,1,2,1,2,1,1,1,2,1,1,2,2,1,2,2,1,6 year old male ,12 year old male ,,4 year old male ,6 year old male,,, 7 year old female ,9 year old male ,5 year old male ,5 year old female ,7 year old female ,9 year old female,4 year old male ,6 year old male ,2 year old male ,6 year old male ,,4 year old male,2 year old male ,,5 year old male,6 year old female ,,1 year old female ,,8 year old male ,,14 year old female ,7 year old male ,12 year old male ,,2 year old female ,2 year old female ,,,3 year old male ,,,3 year old female,7,5,7,1,4,1,4,5,4,7,3,4,2,7,2,6,6,6,1,4,,,This child looks as if he is seeing something that he fears and doesn't know if he should stay or run away. ,,,They look as they recently were upset about something and are now settling down ,They look as if they aren't quite sure if they should talk to the photographer ,,,,,,,,,,,They look exhausted and hungry ,,,They look tired and uncertain ,,,They look as if they are content ,,He looks hungry ,,They look as if they are wondering out their future ,,,,They look as if they have no hope left ,,,They look as if they are lost and isn't sure what to do ,They look sad ,,They look like they have come down from being scared of something ,They look concerned about what will happen next ,,Difficult ,Randomly ,"Yes, the Describe deck",The Feel deck was more difficult to decipher,1,2,4,5,2,3,5,4,Female,AA/Caucasian,30,3,1,3,76,3,31,7,16,29,11,6,23,38,30,19,33,35,9,5,24,36,37,25,40,13,39,22,21,2,4,20,26,27,17,34,10,12,1,8,28,14,15,18,32,3,2,3,13,1,13,7,39,4,11,2,17,2,37,2,44,2,15,2,12,4,16,2,13,2,17,19,21,3,11,3,11,3,21,3,16,2,15,7,18,3,12,3,16,2,12,2,14,2,27,4,11,2,25,2,17,2,28,2,12,4,23,3,16,6,26,2,19,3,13,2,21,2,11,2,11,3,31,2,18,4,228,1035,67,37,83,2,NA,1190,NA,4/14/23 17:40,1,0,87,87,0,0,1.47,34,,,,,,,,,,,,,,,,,,,,,,,,,,,,,,,,,,,,,,,,
247,NA,avila,interview,4/15/23 1:28,1,1,2,1,1,1,2,2,1,1,2,2,1,2,1,1,2,2,2,1,1,2,2,1,2,1,1,1,2,1,2,1,2,1,2,1,2,2,2,2,6 yr old boy,9 yrs old boy,,4 yr old boy,3 yr old boy,3 yr old girl,,,6 yr old boy,3 yr old boy,,,7 yr old girl,,A young boy ~ age 5.,2 yrs old girl,,,,4 yr old boy,1 yr old girl,,,3 yr old boy,,5 yrs old boy,6 year old boy,5 yrs old girl ,,5 yrs old boy,,3 yr old boy,,3 yr old girl,,4 yr old boy,,,,,1,7,5,4,3,3,1,2,5,6,1,4,7,6,7,6,7,7,6,3,,,Shocked and amazed ,,,,Curious and wanting to play ,"Focussed, angry ",,,Confused ,"Sad, angry, hurt",,"Distraught, hurt, betrayed ",,,"Betrayed, hurt, sad","Diaconmected, despair","Hungry, weak, tired, desperate ",,,Interested and optimistic ,Curious skeptical,,Wanting for mother,,,,"Fed up, unimpressed, uninterested ",,Alone and sad,,"Desperation, alone, hungry",,"Curious, distrusting ",,Observant attentive ,Angry and stubborn ,"Stoic, frustrated","Sad, shocked, focussed ",Some photos appeared more candid and dhad a more emotional impact than those that were higher quality/produced. I started reading negative emotions in neutral faces or overly focussing on glossy eyes.,Alternate 1-1,Indifferent. Started preferring the describe but the age was ambiguous enough that I didn't like being unsure. The feelings deck was intriguing by thinking deeper about the pictures but thought about candidness of feelings and difficulty to asses different types of negative emotions.,Did not notice a difference.,4,1,4,3,2,2,2,4,MALE,Hispanic,31,7,4,6,84,15,40,27,19,16,23,1,17,13,12,20,25,9,39,34,7,5,22,36,33,2,3,21,38,29,10,8,32,31,26,11,6,35,4,18,24,14,30,37,28,26,124,1,21,6,19,2,26,2,12,2,11,2,11,2,40,2,44,3,16,1,11,2,41,2,51,1,85,2,19,8,71,2,17,1,50,1,37,3,59,3,22,1,22,1,37,1,39,1,11,2,107,1,37,2,84,2,15,2,22,1,12,1,28,5,18,2,29,2,11,2,22,1,11,2,19,2,30,1,31,4,127,686,45,56,159,43,NA,1803,NA,4/15/23 2:12,1,0,87,87,0,0,1.48,31,,,,,,,,,,,,,,,,,,,,,,,,,,,,,,,,,,,,,,,,
