258,NA,avila,interview,4/15/23 3:26,1,2,1,1,2,2,2,2,1,1,1,1,2,1,2,1,2,1,1,2,2,2,2,1,1,2,2,1,2,1,1,1,1,2,1,2,2,1,2,2,This appears to be a young boy of about 7 years of age ,,This appears to be a young girl of about 3 years of age,This appears to be a little boy of about 4,,,,,This appears to be a little boy of about 6 years of age,This appears to be a little girl of about 5,This appears to be a young girl of about 3 - 4 years old.,This appears to be a young girl of about 8 years of age ,,This appears to be a little boy of about 5,,This appears to be a little girl who is about 1 year old ,,This appears to be a little boy of about 5,This appears to be a young boy of about 5 years of age,,,,,This appears to be a young boy of about 7,This appears to be a young boy of about 1 years old,,,This appears to be a little boy of about 4 years of age,,This appears to be a little boy of about 6 years of age,This appears to be a young girl of about 10,This appears to be a young boy of about 4 years of age,This appears to be a little girl of probably 1 - 2 years old,,This child appears to be a little boy of about 3 years of age ,,,This appears to be a little boy of about 1 - 2 years of age,,,3,7,2,2,6,4,2,3,5,5,3,2,6,6,3,6,6,6,4,3,,This child has experienced consistent disappointment and pain,,,This child has just experienced a great disappointment or loss,This little girl looks sad and a bit confused ,This child looks curious but suspicious ,This child is sad but just got some potentially good news ,,,,,This young person has lived with great sadness and was just given even more bad news,,This little boy was sad but still has a spark of hope ,,This child looks angry at something or someone ,,,"He looks like he's thinking ""really?""",This child looks suspicious of the stranger and relying on Mom for protection ,This child seems to sad but resigned to his situation ,This child seems to be suspicious ,,,This little guy is trying hard to understand a very different or unusual person ,This child is skeptical about what he is being told ,,This young girl looks like she's already seen and experienced too much in her young life,,,,,This child looks very sad and forlorn ,,"This young boy is experiencing disappointment, which has been a constant in his life",This child looks sad but curious ,,This child looks curious and seems to be concentrating deeply,This child is hopeless and confused ,Exhausting ,Primarily went back and forth ,Observe was easier ,Not all of the children in the Observe deck were crying but just about everyone in the Feeling deck was,4,4,5,3,5,5,5,2,Female ,White/Caucasian ,62,3,5,6,86,11,19,37,5,3,34,38,6,39,21,30,8,35,26,13,9,15,28,36,1,22,32,27,12,29,25,20,33,16,17,24,31,2,18,23,4,14,7,10,40,40,57,4,41,5,80,3,62,5,26,5,58,5,60,4,26,7,32,2,43,3,38,6,64,3,77,3,60,5,33,4,43,16,38,6,52,4,33,4,49,8,42,3,67,18,53,7,41,3,35,7,48,4,44,4,52,7,60,9,118,2,49,6,31,3,41,4,51,5,36,3,39,4,78,4,30,3,47,7,40,4,67,182,43,29,137,26,NA,2574,NA,4/15/23 4:11,1,0,87,87,0,0,0.67,1,,,,,,,,,,,,,,,,,,,,,,,,,,,,,,,,,,,,,,,,
260,NA,avila,interview,4/15/23 4:17,2,2,1,2,2,1,2,2,1,2,1,2,2,1,1,2,2,2,2,2,2,1,2,2,2,2,1,1,1,2,2,1,2,2,2,2,1,1,1,2,,,Very large dark eyes with a look of surprise ,,,Young female dark eyes and skin with short hair done in brades,,,8-9 yr old male oval face with short hair and dark eyes,,Young female with bright clothing and round eyes and dark skin,,,Young black male with look of disappointment ,Black male dark hair and eyes with tears and small thin frame,,,,,,,Young male shaved head with wide bridged nose,,,,,Black man showing a look of hopelessness ,Dark skin female with green tint to eyes and medium length braids of dark hair,Early teen male dark skin and eyes with corn rows in hair,,,Very little hair with dark skin and eyes and full lips with sharp chin,,,,,4 yr old black male,"2-3 yr old male, sad and crying","Male with dark eyes, pouty lips approximate age of 5-6",,5,5,2,2,5,3,5,1,4,5,5,3,4,2,4,2,5,5,4,5,Feeling of mild playfulness with some doubt ,Depressed and feeling no hope,,Somewhat confused and show some concern as well,"Very sad, overwhelmed and feeling lost",,Curious with some mild fear,Sadness and appears to be lost in tjought,,Feeling of sadness and no hope,,Hopelessness and shattered dreams for future ,"Sad, needing support and some fear due to lack of eye contact",,,Sad and hoping for help and support ,Feeling of sadness and has lack of hope ,Feels trapped as if things will not change for him in his lifetime ,Very lost with no hope to survive in his world,Feeling of curiosity ,Feeling confusion and sadness ,,Feeling hunger and sad due to unknown future ,Feeling neglected and wondering what is next for him,Sad with no understanding of needs not being met,Pain both physically and mentally ,,,,Feeling slight fear and a need to hide from outside world,Appears to feel not well and tired and depressed ,,Hopelessness and in an emotional way reaching out for help,Depression and mild anxiety of what his life has in store ,Feeling of loss and separation ,Feeling slightly confused ,,,,Depression and hopelessness in life,Fun,Just randomly ,No,Yes,4,3,3,3,5,4,3,3,Female ,Indian ,61,4,3,2,87,2,37,24,5,26,16,38,27,18,40,21,35,9,39,19,31,13,3,7,23,4,28,10,33,11,6,1,20,17,15,32,36,8,25,14,34,22,30,12,29,11,40,2,66,7,35,529,41,3,46,5,32,3,48,5,72,2,50,2,66,3,33,3,40,64,38,2,49,2,48,3,53,3,32,3,48,2,72,3,33,3,55,3,66,3,38,3,60,3,63,3,31,2,30,3,52,3,48,2,45,3,45,2,69,4,55,3,67,3,34,2,92,5,56,4,32,3,48,4,51,2,31,90,40,35,132,20,NA,2460,NA,4/15/23 5:08,1,0,87,87,0,0,0.83,4,,,,,,,,,,,,,,,,,,,,,,,,,,,,,,,,,,,,,,,,
265,NA,avila,interview,4/15/23 11:51,1,2,1,2,2,1,1,1,1,1,2,2,2,2,1,1,1,1,1,1,2,2,1,1,1,2,2,1,2,2,2,2,1,1,2,1,1,2,1,2,11 year old boy,,3-4 male,,,A female probably around 6-7 that is malnourished ,7 year old boy,14 year old girl ,10 year old male ,10-12 year old boy,,,,,12-14 malnourished kid,3 year old girl ,13 year old male,12 year old boy ,4 year old boy ,5 year old male ,,,6 yr old male,6 year old boy student ,3 year old girl,,,16 year old girl,,,,,3 year old baby girl,The young boy around 4-5 looks upset and scared ,,9 year old boy,8 year old boy,,5 year old boy,,1,3,2,1,2,2,4,2,3,5,4,5,4,3,1,2,4,5,1,3,,A troubled boy mad at the world ,,A sad young boy living in a tribe trying to better his life his necklace indicates he has hope ,A tribe boy who has to grow up faster to support his family rather than being a child ,,,,,,The little girl looks scared but can tell she is adventurous and likes to spend her time having fun,A girl who has had a rough life due to her scare and is feeling hopeless even in the arms of some one close ,A scared older man who is trying not to fail for the future of his family ,Even though is comforted he looks tired and upset with the living of life,,,,,,,A pretty young child that doesn't like being left alone because he is scared ,A teenager waiting to escape to a better life with less suffering ,,,,A young boy who is bored and enjoys eating his next meal ,The 10 year old boy looks confused but hungry for an opportunity ,,A young boy dreaming a better life not know what is all out there because lack of experience ,A helpless child seeking for shelter ,He's been through a lot for his age and feels sick of being sad and hopeless,A sick hound child who accepts moving around is a part of life as he welcomes people around him,,,Discouraged and wondering why the well put together photographer is looking at me ,,,A child who doesn't have much and is tired and scared,,A young that has a hard life and is already tired of the day to day ,Heart breaking ,Got bored with the questions so went back and forth,Describing was easier ,Pictures were the same but questions were different ,3,3,1,4,4,3,3,2,Male,White,32,4,3,6,89,35,6,34,31,27,11,10,14,30,2,4,3,15,9,17,32,5,28,20,33,24,19,39,38,12,36,25,7,18,26,13,23,16,21,22,8,37,1,40,29,7,5,4,13,5,57,8,23,7,117,14,58,9,91,3,14,4,12,5,18,5,39,13,40,3,52,3,36,5,64,4,26,4,17,5,24,3,13,6,11,3,18,3,33,4,28,4,18,4,16,4,13,17,41,5,85,4,13,4,33,4,38,3,60,11,63,3,15,8,52,10,136,4,12,3,12,3,26,3,13,4,36,119,39,14,108,3,NA,1745,NA,4/15/23 12:25,1,0,87,87,0,0,1.02,15,,,,,,,,,,,,,,,,,,,,,,,,,,,,,,,,,,,,,,,,
299,NA,avila,interview,4/19/23 18:36,2,2,2,2,2,1,1,1,2,2,2,1,2,2,1,1,1,1,1,1,1,2,1,1,2,1,1,1,1,2,1,2,2,1,2,1,2,1,1,1,,,,,,This child seems to be a girl of about 3 years of age.,This appears to be a child of about 3 of indeterminate gender.,This person appears to be a child of about 7 years old of indeterminate gender.,,,,This appears to be a child of about 6 years old of indeterminate gender.,,,This appears to be a boy of about 5 years of age.,This child appears to be a boy of about 2 years of age.,This child appears to be a boy of about 6 years of age.,This appears to be a boy of about 8 years old.,This appears to be a boy of about 4 years old.,This appears to be a girl of about 3 years of age.,This child seems to be about 2 years old of indeterminate gender.,,This is a young child of perhaps 7 with an indeterminate gender.,This person is a child of perhaps 5 years of age and appears to be male.,,This child appears to be a boy of about 2 years of age.,This child seems to be a boy around 6 years of age.,This appears to be a girl of about 6 years old.,This person seems to be a girl of about 9 years of age.,,This appears to be a child of about 6 years of age of indeterminate gender.,,,This appears to be a girl of about 2 years of age.,,This person appears to be about 4 years old of indeterminate gender.,,This appears to be a child of about 2 years of age of indeterminate gender.,This child appears to be a boy of about 3 years of age.,This appears to be a child of about 2 years old of indeterminate gender.,2,7,2,1,7,2,3,2,5,7,3,2,3,7,1,7,7,7,3,2,"This person looks concerned, suspicious, and unsure.",This child seems to be annoyed and potentially angry.,This person looks surprised at something that has just happened.,This child appears suspicious of the person taking the photo.,This child is upset and traumatized over something that has just happened.,,,,This child looks exhausted and unhappy; perhaps troubled.,This person appears to be feeing sad and upset.,This child looks suspicious and leery of the person taking the photo.,,This person appears to be upset and trying to cope with a circumstance.,This person looks afraid and upset.,,,,,,,,This person seems curious and interested in what is happening.,,,This baby seems to be upset and crying.,,,,,This person seems to be either afraid or very shy and trying to hide.,,This young child is curious about the person taking the photo.,In a state of returning to comfort after a period of being upset.,,This child appears to be curious and suspicious of the person taking the photo.,,"This child seems to be content, but there may be dried tears on the face which would indicate a recent upset.",,,,Redundant,Randomly,No,No,1,1,3,3,1,1,2,4,Female,White,49,1,1,5,95,33,5,32,23,24,2,9,8,6,39,37,27,21,16,29,17,10,22,40,25,18,19,30,14,36,12,3,13,28,20,38,4,1,7,34,15,31,11,26,35,5,47,2,23,2,34,2,16,2,14,2,27,2,21,3,12,2,20,3,25,3,16,2,15,3,18,2,22,3,11,4,11,3,17,3,11,2,11,3,11,4,22,4,17,3,14,3,40,3,34,2,29,2,11,10,38,3,11,3,17,2,18,2,17,3,20,5,58,3,11,4,23,2,26,3,43,3,13,2,15,2,14,131,19,31,127,21,NA,1323,NA,4/19/23 18:58,1,0,87,87,0,0,1.36,20,,,,,,,,,,,,,,,,,,,,,,,,,,,,,,,,,,,,,,,,
315,NA,avila,interview,4/22/23 4:02,1,1,1,2,2,1,2,2,2,2,1,1,2,2,2,2,2,2,2,2,2,2,2,2,2,1,1,2,2,2,2,2,2,2,1,2,2,2,2,1,Male age 8 dirty hair and clothes,8 year old male who is dirty with big brown beautiful eyes,3 year old male Child being protected by adult ,,,"Three year old female with braided hair, silver earrings and blue sweater",,,,,3 year old female with scarf on hair and sucking in the scarf,8 year old male with blunted affect and tears,,,,,,,,,,,,,,6 year old male that is hiding behind wooden supports ,9 years old male with food on their face,,,,,,,,Three year old male with white shirt,,,,,4 year old male,4,2,3,1,1,1,3,4,3,5,3,1,3,6,1,4,7,7,4,6,,,,Confused and anger,"Pain, fear and hopelessness",,Curious and intrigued ,Doubt about others,Conditioned hopelessness,Fatigue and sadness ,,,Let down by others and disappointment ,Scared and seeking comfort ,Lonely and sad,Dependent on others and fear that needs will not be met,Anger and frustration ,"Defeat, fatigue and boredom"," Hunger, sadness, pain and hopelessness",Disappointed with others and unsure if that they are seeing is for real,Protected,Tired of long wait,Hungry and tired,Bored ,Sadness,,,"Protected , content and safe",Bored and disinterest on what is going on around them,Hopelessness and defeat about situation ,Unhealthy,Scared and defeated,Sadness and dependent on others to get their needs met,They are experiencing sadness and shy,,Anger,Content and protected,Anger,Safe and confortable,,Exhausting due to the emotions,Alternated when feeling sadness about pictures,Feelings were easier for me to describe. Emotional thinker not logical,Logical vs emotional thinking,5,5,5,4,2,2,2,5,Female,Caucasian ,50,4,3,6,97,34,12,30,33,29,38,2,11,25,1,14,15,35,32,9,7,24,6,5,4,40,10,16,13,21,31,3,36,27,17,8,26,20,22,23,19,37,39,18,28,22,108,5,24,17,44,4,42,5,17,4,22,4,38,4,34,5,62,4,16,5,25,4,38,5,52,4,23,4,14,6,12,7,32,4,16,5,31,4,23,5,62,6,12,5,13,4,13,4,12,4,21,6,30,5,32,4,23,4,30,5,27,3,15,4,12,5,54,8,42,4,24,4,12,5,12,4,22,5,17,5,30,160,45,34,168,30,NA,1827,NA,4/22/23 4:33,1,0,87,87,0,0,0.94,8,,,,,,,,,,,,,,,,,,,,,,,,,,,,,,,,,,,,,,,,
316,NA,avila,interview,4/22/23 4:02,1,1,1,1,1,1,1,1,1,2,1,1,1,1,1,1,1,1,1,1,1,1,1,1,1,1,1,1,2,1,2,1,1,2,1,1,1,1,1,1,Young African American boy.,Young African American boy.,Young African American boy.,Young African American boy.,Young African American boy.,Young African American girl.,Young boy who is African American.,Young African American boy.,Young African American boy,,Young African American girl.,Young African American boy.,Young African American boy.,Young African American boy.,Young African American boy.,A young boy who is African American ,Young African American boy.,Young African American boy.,Young African American boy.,Young African American boy.,Young African American boy.,Young African American boy.,Young African American boy.,Young African American boy.,Baby African American boy,Young African American boy.,Young African American boy.,Young African American boy.,,Young African American boy.,,Young African American boy.,Young African American boy.,,Young African American boy.,Young African American boy.,Young African American boy.,Young African American boy.,Young African American boy.,Young African American boy.,3,3,3,4,6,3,3,2,3,3,3,2,3,4,6,5,1,3,5,2,,,,,,,,,,The boy is feeling pain and sadness.,,,,,,,,,,,,,,,,,,,This boy is feeling exaughstion and is tired.,,The boy is feeling discomfort and uneasiness. ,,,The boy is feel distraught and crying from sadness.,,,,,,,It was long and boring.,Well I tried both at first and then realized they were all the same emotion pretty much so I got bored and just stuck with appearance. Plus I like the color red.,Yes the appearance deck.,Yes one was asking to describe the child appearance while the other was asking me to perceive and guess the child emotions.,1,1,3,3,2,2,3,2,Female,White,18,4,3,2,98,7,16,34,26,29,22,31,23,2,17,40,10,21,8,5,28,12,39,37,27,11,36,35,38,33,32,18,1,20,4,3,14,13,15,30,6,19,24,25,9,18,78,2,12,3,12,2,12,2,12,2,16,2,11,7,55,2,11,2,11,2,49,1,12,2,11,2,11,2,12,1,12,4,39,1,12,2,11,1,22,3,11,2,11,2,19,2,11,1,11,2,11,3,16,1,12,2,11,2,16,2,11,2,25,3,12,3,11,4,28,7,11,2,12,1,12,2,11,6,12,2,11,129,20,29,90,20,NA,1105,NA,4/22/23 4:20,1,0,87,87,0,0,1.78,43,,,,,,,,,,,,,,,,,,,,,,,,,,,,,,,,,,,,,,,,
330,NA,avila,interview,4/22/23 4:24,1,1,2,2,1,1,2,1,1,1,2,1,2,2,2,1,1,2,1,1,1,2,2,1,2,1,2,1,1,1,1,2,2,1,2,1,1,2,2,1,This young male child is about 5 years old. ,This young child is about 7 years old. ,,,This little girl is about 3 years old.,This little girl is about 4.,,This young girl is 12 years old. ,This boy is 13 years old.,The boy is about 10 years old,,The boy in the picture is 5 years old.,,,,This adorable baby girl is roughly a year old,This young boy is about 4 years old. ,,This poor baby is a boy and he is about 2 years old. ,This little girl is three years old. ,This baby girl is about 18 months old. ,,,I would say this little boy is about 6 years old. ,,This little boy with beautiful eyes is about 3 years old. ,,The little girl is three to four years of age. ,This little girl is about 10 years old. ,This boy is 11 years old.,This photo is of a seven year old female.,,,This young child is a about 3. ,,This beautiful boy is three years old. ,I would say that this is a girl and she is around 12. ,,,This sweet little girl is 2 years old.,7,4,7,2,1,1,3,3,4,7,3,7,5,2,6,2,5,2,7,7,,,This baby being held by his  baby has likely suffered physical illness due to poverty and malnutrition and feels physical pain. ,I feel this young child is a bit angry about getting his photo taken. ,,,This little boy was hiding and is feeling mad because he was caught. ,,,,I feel sad for this little girl because her life is likely very different than other girls and she has missed out. ,,"The young woman has gone through so much loss in her life and is tearful, wondering how much more can one person possibly endure. ",This little guy is feeling scared and is in need of some comfort and reassurance. ,This little boy hasn't had much sleep and is feeling sad because it's time to get up. ,,,This young boy feels  disappointed and frustrated after someone didn't follow through with something they said they were going to do. ,,,,This boy is helping on his farm and is feeling a little camera shy.,This child has been experiencing illness and is feeling lonely because she has lost her family. ,,This baby is experiencing something new and is feeling inquisitive.,,This boy has likely grown up in an area that is hot and humid and is feeling that it be wonderful to have enough money for air conditioning.  ,,,,,This child has never had adequate medical care and is feeling vulnerable due to fear of the unknown and people he does not know or trust. ,This baby is crying because he feels insecure and afraid after his mother temporarily left the room ,,This little guy is feeling a bit curious about why a stranger is taking his photo. ,,,This child is experiencing hunger and is feeling pain and hopelessnes. ,"When I look at this picture, this little guys appears to be putting on a brave face during a medical check up, but inside he's scared and just wants it over with. ",,"Time consuming, thinking about if there is a right or wrong way to answer these questions, wondering why every pic appeared like there were tears. ",The amount of time it was taking. The one deck asking age and gender seemed to be less time consuming.,No,Yes. ,1,1,3,4,3,3,3,2,Female,Caucasian,53,3,2,4,100,31,38,1,23,33,36,12,13,32,17,20,18,28,2,3,40,26,8,29,15,30,21,22,25,35,14,10,24,4,11,5,34,39,16,27,6,37,19,9,7,41,78,518,53,6,92,4,551,10,369,5,84,9,41,6,206,14,151,7,48,13,74,5,191,4,93,7,411,10,96,12,115,4,87,7,56,7,288,9,72,7,66,5,41,7,121,6,153,25,76,5,59,13,123,11,218,11,98,5,77,7,69,15,68,9,183,9,182,6,107,4,174,6,67,4,118,8,129,7,243,6,110,473,45,92,370,46,NA,2600,NA,4/22/23 6:30,1,0,87,87,0,0,0.36,0,,,,,,,,,,,,,,,,,,,,,,,,,,,,,,,,,,,,,,,,
331,NA,avila,interview,4/22/23 4:25,1,2,1,2,1,2,2,2,2,2,2,2,2,1,1,2,2,2,2,2,2,2,2,2,1,1,1,1,1,1,1,1,1,2,2,1,1,1,2,1,This young person has dark ski. A,,This yiu g person with dark skin and dark eyes has wide eyes and a slightly open mouth,,Thos yoing person with dark eyes and dark skin has tears going down their face. They are wearing a red and yellow shirt,,,,,,,,,This young person with dark skin and brown eyes has tears and a striped dark blue and white polo shirt,This is a young person with dark skin and dark eyes who is crying without a shirt on. ,,,,,,,,,,This young person with dark skin and brown eyes is crying onto their red shirt,This young person with dark skin and dark eyes is aeari g ablue and white steiped shirt with a left hand on resting on the cheek of his face. ,This young person with dark skin a d dark eyes is wearing a blue and yellow collared shiet. ,This young person had dark skin and golden/green eyes with braids,"This yoing person with dark skin and dark eyes has dirt on their face, tight hair in braids and a yellow shirt",A dark skinned young person wrapped in torn clothe,Dark skin boy with brown eyes and a blue shirt with pink stitching,This yoj g person had dark skin and dark eyes wearing a blue and yellow plaid shirt. ,This young person whomis dark skinned with drak eyes has tears streaming down her face. ,,,A young person in a white shirt whonhas dark eyes and dark skin,This young person has dark hair and dark eyes and is wearing a green and yellow plaid shiet,This person with dark skin and dark eyes is quite you g woth tears steaming down eyes,,This young person has dark skin a d short curly hair,1,6,1,3,5,2,4,2,6,6,4,5,5,7,2,5,6,6,5,2,,This person looks a little muddy and perhaps itritated,,This young person is sad,,This young person appears to be sad and in need of a hug,A young child who is curious about the cameraman,This person appears to be sad and in need of a hug,This young person looks lonely,This person appears sad and in need of comfort,This young person seems curious about the cameraman,This young person is very sad,This young person is very sad in need of a hug.,,,This young person is upset and needs to be held,This person seems sad and in need of a hug,This yoi g person appears to be tired,Please get this person some food and nutrients ,This young person appears to be content hanging out and chilling,This person is feeling loved and protected by a person they trust. ,This person is perhaps feeling passive.,This person appears to be sick or fighting an illness and could use some extra care,This person looks bored in school,,,,,,,,,,This young person is extremely sad and looks like they need to be comforted,This young an doesnt know what to think about the camerman and is sizing him up. ,,,,This child is focused and determined,,It could be dofficult to separate feeling from fact,Random perhaps everyotjer at first,Feeling,Just emotions,2,2,2,4,4,4,3,3,Female,White,36,2,4,7,101,31,12,39,30,36,7,33,22,15,4,25,21,35,14,34,5,13,3,17,27,16,26,2,28,9,18,11,6,32,10,40,20,1,29,23,37,19,8,38,24,11,60,2,16,2,27,1,32,9,26,3,45,2,29,3,34,3,23,2,16,2,23,2,24,4,40,2,23,2,49,2,52,2,20,2,11,2,63,4,37,2,46,2,27,4,53,2,90,2,16,2,39,3,46,3,45,3,40,3,46,3,45,7,61,2,28,3,41,2,46,3,26,3,42,2,29,4,48,5,33,2,38,115,39,26,110,5,NA,1890,NA,4/22/23 4:58,1,0,87,87,0,0,1.08,12,,,,,,,,,,,,,,,,,,,,,,,,,,,,,,,,,,,,,,,,
343,NA,avila,interview,4/22/23 15:22,1,1,2,2,2,2,2,2,2,1,2,2,2,1,2,2,2,1,2,1,1,1,2,1,1,1,2,1,2,2,1,1,2,2,1,2,1,2,1,2,"This child's hair is crusty, he has skin lesions and is very dirty","She has dirty skin, mouth downturned, eyes droopy",,,,,,,,"Brow is knotted, tears running down face, nose running, corners of mouth downturned.",,,,"Brow furrowed, expression is unpleasant, well-clothed",,,,"Smooth skin, unsmiling, too thin, eyes unfocused",,"Dirty, unkempt, unsmiling","Smooth skin, bright eyes, held safely in someone's arms","Eyes staring, fingers hanging,smooth skin",,"Clean, clothed, beautiful face but well-nourished",This little child is crying and unsmiling,"Handsome little boy, bright eyes, crusty nose, unsmiling, dirty",,Young girl with beautiful eyes,,,"Brown eyes, brown skin, clothed, whites of eyes slightly bloodshot","Huge eyes, huge forehead, unsmiling, lots of hands around him",,,"Unsmiling, clean, hooded eyes",,"Dark skin, dark eyes, tear streaked face, unsmiling",,"Dark, large eyes, tears, not alone",,7,2,5,6,1,1,6,4,6,2,1,1,7,3,3,5,2,4,6,2,,,"This boy might feel surprised, disbelieving, frightened","Pleading, disgruntled, wanting something","This little child feels heartbroken, angry, scared","Sad, crying child longing for security","Curious, uncertain, cautious","This young child has experienced something that brought tears, maybe loss, but also could be happy","Another sad face, tired, pensive",,"This child feels uncertain, but curious","Again: sad, hopeless, despairing ","This person might feel heartbroken, disappointed, sad",,"This young boy is hurting, deeply upset, sad, hopeless",This child feels sad and upset,"More sadness, hopelessness, fear",,"This little child feels hopeless, hungry, sad, despairing ",,,,"This child feels distrusting, hungry, skeptical",,,,"Sadness, longing",,This child feels deafest and hopelessness ,"Child feels Scared, uncertain",,,"Sad beauty, deep longing","This child feels very sad, unhappy, and hopeless",,He feels angry and sad,,"Unhappy, upset, crying, sad",,"Hungry, sad, hopeless ",Frustrating because they were all unhappy and it took a long time,Random,Feelings more than description,More tears on the right,3,3,3,3,3,3,3,3,Female,White,66,2,3,3,105,28,27,31,4,6,37,8,24,38,33,26,15,18,9,25,40,21,16,35,30,22,7,3,20,13,5,23,32,19,39,34,1,36,2,17,12,10,29,14,11,57,41,4,44,3,47,21,63,3,48,7,29,4,49,4,24,3,88,4,50,3,54,3,25,3,31,2,32,7,71,6,46,6,42,3,25,3,51,4,33,4,99,5,46,3,60,3,55,3,51,11,46,5,67,6,32,4,29,4,20,10,38,4,93,2,54,4,37,3,53,4,34,3,29,3,48,3,32,3,49,4,17,151,33,31,120,26,NA,2337,NA,4/22/23 16:03,1,0,87,87,0,0,0.76,2,,,,,,,,,,,,,,,,,,,,,,,,,,,,,,,,,,,,,,,,
